[root@db-07 ~]# smartctl -a /dev/nvme1
smartctl 7.4 2023-08-01 r5530 [x86_64-linux-6.8.0-45-generic] (local build)
Copyright (C) 2002-23, Bruce Allen, Christian Franke, www.smartmontools.org

=== START OF INFORMATION SECTION ===
Model Number:                       INTEL SSDPE2KX020T8
Serial Number:                      PHLJFAKE000004
Firmware Version:                   VDV10184
PCI Vendor/Subsystem ID:            0x8086
IEEE OUI Identifier:                0x5cd2e4
Total NVM Capacity:                 2,000,398,934,016 [2.00 TB]
Unallocated NVM Capacity:           0
Controller ID:                      0
NVMe Version:                       1.2
Number of Namespaces:               1
Namespace 1 Size/Capacity:          2,000,398,934,016 [2.00 TB]
Namespace 1 Formatted LBA Size:     512
Local Time is:                      Thu Oct  2 10:02:44 2026 UTC
Firmware Updates (0x02):            1 Slot
Optional Admin Commands (0x000e):   Format Frmw_DL NS_Mngmt
Optional NVM Commands (0x0006):     Wr_Unc DS_Mngmt
Log Page Attributes (0x0e):         Cmd_Eff_Lg Ext_Get_Lg Telmtry_Lg
Maximum Data Transfer Size:         32 Pages
Warning  Comp. Temp. Threshold:     70 Celsius
Critical Comp. Temp. Threshold:     80 Celsius

Supported Power States
St Op     Max   Active     Idle   RL RT WL WT  Ent_Lat  Ex_Lat
 0 +    25.00W       -        -    0  0  0  0        0       0

Supported LBA Sizes (NSID 0x1)
Id Fmt  Data  Metadt  Rel_Perf
 0 +     512       0         2
 1 -    4096       0         0

=== START OF SMART DATA SECTION ===
SMART overall-health self-assessment test result: FAILED!
- NVM subsystem reliability has been degraded

SMART/Health Information (NVMe Log 0x02, NSID 0xffffffff)
Critical Warning:                   0x04
Temperature:                        39 Celsius
Available Spare:                    98%
Available Spare Threshold:          10%
Percentage Used:                    93%
Data Units Read:                    2,841,665,307 [1.45 PB]
Data Units Written:                 3,567,880,214 [1.82 PB]
Host Read Commands:                 41,221,789,301
Host Write Commands:                38,410,067,512
Controller Busy Time:               88,103
Power Cycles:                       63
Power On Hours:                     39,871
Unsafe Shutdowns:                   88
Media and Data Integrity Errors:    112
Error Information Log Entries:      4,212
Warning  Comp. Temperature Time:    0
Critical Comp. Temperature Time:    0

Error Information (NVMe Log 0x01, 16 of 64 entries)
Num   ErrCount  SQId   CmdId  Status  PELoc          LBA  NSID    VS  Message
  0       4212     2  0x0071  0xc502  0x000   1883410432     1     -  Unrecovered Read Error
  1       4211     5  0x0044  0xc502  0x000   1883410440     1     -  Unrecovered Read Error

Self-test Log (NVMe Log 0x06)
Self-test status: No self-test in progress
No Self-tests Logged

