root@host-example:~# smartctl -a /dev/sda
smartctl 6.6 2016-05-31 r4324 [x86_64-linux-4.15.0-112-generic] (local build)
Copyright (C) 2002-16, Bruce Allen, Christian Franke, www.smartmontools.org

=== START OF INFORMATION SECTION ===
Model Family:     SandForce Driven SSDs
Device Model:     KINGSTON SV300S37A120G
Serial Number:    FAKE-SF-SERIAL-0001
Firmware Version: 603ABBF0
User Capacity:    120,034,123,776 bytes [120 GB]
Sector Size:      512 bytes logical/physical
Rotation Rate:    Solid State Device
Device is:        In smartctl database [for details use: -P show]
ATA Version is:   ATA8-ACS, ACS-2 T13/2015-D revision 3
SATA Version is:  SATA 3.0, 6.0 Gb/s (current: 6.0 Gb/s)
Local Time is:    Sat Oct  3 10:00:00 2026 UTC
SMART support is: Available - device has SMART capability.
SMART support is: Enabled

=== START OF READ SMART DATA SECTION ===
SMART overall-health self-assessment test result: PASSED

SMART Attributes Data Structure revision number: 10
Vendor Specific SMART Attributes with Thresholds:
ID# ATTRIBUTE_NAME          FLAG     VALUE WORST THRESH TYPE      UPDATED  WHEN_FAILED RAW_VALUE
  1 Raw_Read_Error_Rate     0x0032   095   095   050    Old_age   Always       -       0/7861120
  5 Retired_Block_Count     0x0033   100   100   003    Pre-fail  Always       -       0
  9 Power_On_Hours_and_Msec 0x0032   060   060   000    Old_age   Always       -       35628h+11m+21.300s
 12 Power_Cycle_Count       0x0032   100   100   000    Old_age   Always       -       298
171 Program_Fail_Count      0x000a   100   100   000    Old_age   Always       -       0
172 Erase_Fail_Count        0x0032   100   100   000    Old_age   Always       -       0
174 Unexpect_Power_Loss_Ct  0x0030   000   000   000    Old_age   Offline      -       139
177 Wear_Range_Delta        0x0000   000   000   000    Old_age   Offline      -       1
181 Program_Fail_Count      0x000a   100   100   000    Old_age   Always       -       0
182 Erase_Fail_Count        0x0032   100   100   000    Old_age   Always       -       0
187 Reported_Uncorrect      0x0012   100   100   000    Old_age   Always       -       0
189 Airflow_Temperature_Cel 0x0000   030   045   000    Old_age   Offline      -       30 (Min/Max 18/45)
194 Temperature_Celsius     0x0022   030   045   000    Old_age   Always       -       30 (Min/Max 18/45)
195 ECC_Uncorr_Error_Count  0x001c   120   120   000    Old_age   Offline      -       0/7861120
196 Reallocated_Event_Count 0x0033   100   100   003    Pre-fail  Always       -       0
201 Unc_Soft_Read_Err_Rate  0x001c   120   120   000    Old_age   Offline      -       0/7861120
204 Soft_ECC_Correct_Rate   0x001c   120   120   000    Old_age   Offline      -       0/7861120
230 Life_Curve_Status       0x0013   100   100   000    Pre-fail  Always       -       100
231 SSD_Life_Left           0x0013   100   100   010    Pre-fail  Always       -       0
233 SandForce_Internal      0x0032   000   000   000    Old_age   Always       -       21418
234 SandForce_Internal      0x0032   000   000   000    Old_age   Always       -       17883
241 Lifetime_Writes_GiB     0x0032   000   000   000    Old_age   Always       -       17883
242 Lifetime_Reads_GiB      0x0032   000   000   000    Old_age   Always       -       17003
244 Unknown_Attribute       0x0000   100   100   000    Old_age   Offline      -       0
