smartctl 7.2 2020-12-30 r5155 [x86_64-linux-5.15.0-91-generic] (local build)
Copyright (C) 2002-20, Bruce Allen, Christian Franke, www.smartmontools.org

=== START OF INFORMATION SECTION ===
Model Number:                       SAMSUNG MZ1LB1T9HALS-00007
Serial Number:                      S436NFAKE00037
Firmware Version:                   GDC5602Q
PCI Vendor/Subsystem ID:            0x144d
IEEE OUI Identifier:                0x002538
Total NVM Capacity:                 3,840,755,982,336 [3.84 TB]
Unallocated NVM Capacity:           0
Controller ID:                      6
NVMe Version:                       1.4
Number of Namespaces:               32
Namespace 1 Size/Capacity:          3,840,755,982,336 [3.84 TB]
Namespace 1 Utilization:            1,170,013,577,216 [1.17 TB]
Namespace 1 Formatted LBA Size:     512
Local Time is:                      Thu Oct  2 09:31:05 2026 UTC
Firmware Updates (0x17):            3 Slots, Slot 1 R/O, no Reset required
Optional Admin Commands (0x005f):   Security Format Frmw_DL NS_Mngmt Self_Test MI_Snd/Rec
Optional NVM Commands (0x005f):     Comp Wr_Unc DS_Mngmt Wr_Zero Sav/Sel_Feat Timestmp
Log Page Attributes (0x0e):         Cmd_Eff_Lg Ext_Get_Lg Telmtry_Lg
Maximum Data Transfer Size:         512 Pages
Warning  Comp. Temp. Threshold:     80 Celsius
Critical Comp. Temp. Threshold:     83 Celsius
Namespace 1 Features (0x1a):        NA_Fields No_ID_Reuse NP_Fields

Supported Power States
St Op     Max   Active     Idle   RL RT WL WT  Ent_Lat  Ex_Lat
 0 +    25.00W   14.00W       -    0  0  0  0       70      70
 1 +     8.00W    8.00W       -    1  1  1  1       70      70

Supported LBA Sizes (NSID 0x1)
Id Fmt  Data  Metadt  Rel_Perf
 0 +     512       0         0
 1 -    4096       0         0

=== START OF SMART DATA SECTION ===
SMART overall-health self-assessment test result: PASSED

SMART/Health Information (NVMe Log 0x02)
Critical Warning:                   0x00
Temperature:                        36 Celsius
Available Spare:                    100%
Available Spare Threshold:          10%
Percentage Used:                    3%
Data Units Read:                    1,236,890,103 [633 TB]
Data Units Written:                 952,103,664 [487 TB]
Host Read Commands:                 9,876,543,210
Host Write Commands:                8,765,432,109
Controller Busy Time:               12,345
Power Cycles:                       41
Power On Hours:                     18,412
Unsafe Shutdowns:                   17
Media and Data Integrity Errors:    37
Error Information Log Entries:      412
Warning  Comp. Temperature Time:    0
Critical Comp. Temperature Time:    0
Temperature Sensor 1:               36 Celsius
Temperature Sensor 2:               44 Celsius
Temperature Sensor 3:               51 Celsius

Error Information (NVMe Log 0x01, 16 of 64 entries)
Num   ErrCount  SQId   CmdId  Status  PELoc          LBA  NSID    VS
  0        412     3  0x0078  0xc502  0x000   1029386112     1     -
  1        411     5  0x0041  0xc502  0x000   1029386104     1     -

