smartctl 7.4 2023-08-01 r5530 [x86_64-linux-6.8.0-45-generic] (local build)
Copyright (C) 2002-23, Bruce Allen, Christian Franke, www.smartmontools.org

=== START OF READ SMART DATA SECTION ===
SMART overall-health self-assessment test result: PASSED

SMART Attributes Data Structure revision number: 10
Vendor Specific SMART Attributes with Thresholds:
ID# ATTRIBUTE_NAME          FLAG     VALUE WORST THRESH TYPE      UPDATED  WHEN_FAILED RAW_VALUE
  1 Raw_Read_Error_Rate     0x000f   077   064   044    Pre-fail  Always       -       52164783
  3 Spin_Up_Time            0x0003   092   091   000    Pre-fail  Always       -       0
  5 Reallocated_Sector_Ct   0x0033   093   093   010    Pre-fail  Always       -       412
  9 Power_On_Hours          0x0032   061   061   000    Old_age   Always       -       34512
187 Reported_Uncorrect      0x0032   100   100   000    Old_age   Always       -       0
194 Temperature_Celsius     0x0022   036   048   000    Old_age   Always       -       36 (0 21 0 0 0)
197 Current_Pending_Sector  0x0012   100   100   000    Old_age   Always       -       0
198 Offline_Uncorrectable   0x0010   100   100   000    Old_age   Offline      -       0

