root@stor-03.example.invalid:~# for d in /dev/sda /dev/sdb /dev/sdc /dev/sdd /dev/nvme0; do echo "=== $d ==="; smartctl -a $d; done
=== /dev/sda ===
smartctl 7.3 2022-02-28 r5338 [x86_64-linux-6.1.0-25-amd64] (local build)
Copyright (C) 2002-22, Bruce Allen, Christian Franke, www.smartmontools.org

=== START OF INFORMATION SECTION ===
Model Family:     Crucial/Micron Client SSDs
Device Model:     CT1000MX500SSD1
Serial Number:    2317FAKE0005
LU WWN Device Id: 5 00a075 1000000005
Firmware Version: M3CR045
User Capacity:    1,000,204,886,016 bytes [1.00 TB]
Sector Sizes:     512 bytes logical, 4096 bytes physical
Rotation Rate:    Solid State Device
Form Factor:      2.5 inches
TRIM Command:     Available
Device is:        In smartctl database 7.3/5319
ATA Version is:   ACS-3 T13/2161-D revision 5
SATA Version is:  SATA 3.3, 6.0 Gb/s (current: 6.0 Gb/s)
Local Time is:    Thu Oct  2 11:02:10 2026 UTC
SMART support is: Available - device has SMART capability.
SMART support is: Enabled

=== START OF READ SMART DATA SECTION ===
SMART overall-health self-assessment test result: PASSED

SMART Attributes Data Structure revision number: 16
Vendor Specific SMART Attributes with Thresholds:
ID# ATTRIBUTE_NAME          FLAG     VALUE WORST THRESH TYPE      UPDATED  WHEN_FAILED RAW_VALUE
  1 Raw_Read_Error_Rate     0x002f   100   100   000    Pre-fail  Always       -       0
  5 Reallocate_NAND_Blk_Cnt 0x0032   100   100   010    Old_age   Always       -       0
  9 Power_On_Hours          0x0032   100   100   000    Old_age   Always       -       21877
 12 Power_Cycle_Count       0x0032   100   100   000    Old_age   Always       -       97
171 Program_Fail_Count      0x0032   100   100   000    Old_age   Always       -       0
172 Erase_Fail_Count        0x0032   100   100   000    Old_age   Always       -       0
173 Ave_Block-Erase_Count   0x0032   025   025   000    Old_age   Always       -       1131
174 Unexpect_Power_Loss_Ct  0x0032   100   100   000    Old_age   Always       -       52
180 Unused_Reserve_NAND_Blk 0x0033   000   000   000    Pre-fail  Always       -       44
183 SATA_Interfac_Downshift 0x0032   100   100   000    Old_age   Always       -       0
184 Error_Correction_Count  0x0032   100   100   000    Old_age   Always       -       0
187 Reported_Uncorrect      0x0032   100   100   000    Old_age   Always       -       0
194 Temperature_Celsius     0x0022   066   048   000    Old_age   Always       -       34 (Min/Max 0/52)
196 Reallocated_Event_Count 0x0032   100   100   000    Old_age   Always       -       0
197 Current_Pending_ECC_Cnt 0x0032   100   100   000    Old_age   Always       -       1
198 Offline_Uncorrectable   0x0030   100   100   000    Old_age   Offline      -       0
199 UDMA_CRC_Error_Count    0x0032   100   100   000    Old_age   Always       -       0
202 Percent_Lifetime_Remain 0x0030   025   025   001    Old_age   Offline      -       75
206 Write_Error_Rate        0x000e   100   100   000    Old_age   Always       -       0
210 Success_RAIN_Recov_Cnt  0x0032   100   100   000    Old_age   Always       -       0
246 Total_LBAs_Written      0x0032   100   100   000    Old_age   Always       -       89234567890
247 Host_Program_Page_Count 0x0032   100   100   000    Old_age   Always       -       2788580246
248 FTL_Program_Page_Count  0x0032   100   100   000    Old_age   Always       -       5012345678

SMART Error Log Version: 1
No Errors Logged

SMART Self-test log structure revision number 1
No self-tests have been logged.  [To run self-tests, use: smartctl -t]

=== /dev/sdb ===
smartctl 7.3 2022-02-28 r5338 [x86_64-linux-6.1.0-25-amd64] (local build)
Copyright (C) 2002-22, Bruce Allen, Christian Franke, www.smartmontools.org

=== START OF INFORMATION SECTION ===
Model Family:     Seagate Exos X12
Device Model:     ST12000NM0007-2A1101
Serial Number:    ZJVFAKE06
LU WWN Device Id: 5 000c50 0b0000006
Firmware Version: SN02
User Capacity:    12,000,138,625,024 bytes [12.0 TB]
Sector Sizes:     512 bytes logical, 4096 bytes physical
Rotation Rate:    7200 rpm
Form Factor:      3.5 inches
Device is:        In smartctl database 7.3/5319
ATA Version is:   ACS-4 (minor revision not indicated)
SATA Version is:  SATA 3.3, 6.0 Gb/s (current: 6.0 Gb/s)
Local Time is:    Thu Oct  2 11:02:12 2026 UTC
SMART support is: Available - device has SMART capability.
SMART support is: Enabled

=== START OF READ SMART DATA SECTION ===
SMART overall-health self-assessment test result: FAILED!
Drive failure expected in less than 24 hours. SAVE ALL DATA.
See vendor-specific Attribute list for failed Attributes.

SMART Attributes Data Structure revision number: 10
Vendor Specific SMART Attributes with Thresholds:
ID# ATTRIBUTE_NAME          FLAG     VALUE WORST THRESH TYPE      UPDATED  WHEN_FAILED RAW_VALUE
  1 Raw_Read_Error_Rate     0x000f   058   055   044    Pre-fail  Always       -       93413584
  3 Spin_Up_Time            0x0003   090   089   000    Pre-fail  Always       -       0
  4 Start_Stop_Count        0x0032   100   100   020    Old_age   Always       -       77
  5 Reallocated_Sector_Ct   0x0033   001   001   010    Pre-fail  Always   FAILING_NOW 65528
  7 Seek_Error_Rate         0x000f   079   060   045    Pre-fail  Always       -       83620541
  9 Power_On_Hours          0x0032   042   042   000    Old_age   Always       -       51133
 10 Spin_Retry_Count        0x0013   100   100   097    Pre-fail  Always       -       0
 12 Power_Cycle_Count       0x0032   100   100   020    Old_age   Always       -       77
187 Reported_Uncorrect      0x0032   001   001   000    Old_age   Always       -       1270
188 Command_Timeout         0x0032   100   097   000    Old_age   Always       -       0 1 3
190 Airflow_Temperature_Cel 0x0022   061   045   040    Old_age   Always       -       39 (Min/Max 26/41)
194 Temperature_Celsius     0x0022   039   055   000    Old_age   Always       -       39 (0 21 0 0 0)
197 Current_Pending_Sector  0x0012   096   096   000    Old_age   Always       -       656
198 Offline_Uncorrectable   0x0010   096   096   000    Old_age   Offline      -       656
199 UDMA_CRC_Error_Count    0x003e   200   200   000    Old_age   Always       -       0

SMART Error Log Version: 1
ATA Error Count: 1312 (device log contains only the most recent five errors)

SMART Self-test log structure revision number 1
Num  Test_Description    Status                  Remaining  LifeTime(hours)  LBA_of_first_error
# 1  Short offline       Completed: read failure       90%     51123         1953525160
# 2  Short offline       Completed without error       00%     50411         -

=== /dev/sdc ===
smartctl 7.3 2022-02-28 r5338 [x86_64-linux-6.1.0-25-amd64] (local build)
Copyright (C) 2002-22, Bruce Allen, Christian Franke, www.smartmontools.org

/dev/sdc: Unknown USB bridge [0x046b:0xff31 (0x504)]
Please specify device type with the -d option.

Use smartctl -h to get a usage summary

=== /dev/sdd ===
smartctl 7.3 2022-02-28 r5338 [x86_64-linux-6.1.0-25-amd64] (local build)
Copyright (C) 2002-22, Bruce Allen, Christian Franke, www.smartmontools.org

Smartctl open device: /dev/sdd failed: DELL or MegaRaid controller, please try adding '-d megaraid,N'
=== /dev/nvme0 ===
smartctl 7.3 2022-02-28 r5338 [x86_64-linux-6.1.0-25-amd64] (local build)
Copyright (C) 2002-22, Bruce Allen, Christian Franke, www.smartmontools.org

=== START OF INFORMATION SECTION ===
Model Number:                       Micron_7450_MTFDKCC1T9TFR
Serial Number:                      23FAKE0000NV
Firmware Version:                   E2MU200
PCI Vendor/Subsystem ID:            0x1344
IEEE OUI Identifier:                0x00a075
Total NVM Capacity:                 1,920,383,410,176 [1.92 TB]
Unallocated NVM Capacity:           0
Controller ID:                      0
NVMe Version:                       1.4
Number of Namespaces:               128
Namespace 1 Size/Capacity:          1,920,383,410,176 [1.92 TB]
Namespace 1 Formatted LBA Size:     512
Local Time is:                      Thu Oct  2 11:02:15 2026 UTC

=== START OF SMART DATA SECTION ===
SMART overall-health self-assessment test result: PASSED

SMART/Health Information (NVMe Log 0x02)
Critical Warning:                   0x00
Temperature:                        41 Celsius
Available Spare:                    100%
Available Spare Threshold:          5%
Percentage Used:                    1%
Data Units Read:                    81,920,316 [41.9 TB]
Data Units Written:                 120,446,092 [61.6 TB]
Host Read Commands:                 912,345,678
Host Write Commands:                1,234,567,890
Controller Busy Time:               1,021
Power Cycles:                       19
Power On Hours:                     9,876
Unsafe Shutdowns:                   7
Media and Data Integrity Errors:    0
Error Information Log Entries:      0
Warning  Comp. Temperature Time:    0
Critical Comp. Temperature Time:    0

Error Information (NVMe Log 0x01, 16 of 256 entries)
No Errors Logged

root@stor-03.example.invalid:~#
